{
  "$schema": "../../Schemas/research-migration-provenance-v1.json",
  "destinationImportCommit": "3f5a1cc2bf6d5723f46f583bb0762864ee534de0",
  "sourceRepository": "swift-foundations/swift-html-render",
  "sourceCommit": "c95ffd82953d577dc46b6b44819c8960ab621513",
  "sourcePath": "Research",
  "sourceTree": "08276252f8ef48379e035a3f405e6db26c36c1d0",
  "destinationPath": "Packages/swift-html-render",
  "equality": {
    "fileList": "verified",
    "blobs": "verified",
    "sourceFilesExcludeDestinationMetadata": true
  },
  "programme": "https://github.com/swift-institute/.github/issues/527",
  "task": "https://github.com/swift-institute/Research/issues/11"
}
