{
  "$schema": "../../Schemas/research-migration-provenance-v1.json",
  "destinationImportCommit": "41a8e1920c50e46da14e10273fe9f71d496e5027",
  "sourceRepository": "swift-foundations/swift-posix",
  "sourceCommit": "ab4b8484e264ef50ebcb3065b27c7596662b1568",
  "sourcePath": "Research",
  "sourceTree": "3a9d5332750fe581fcdd4039ad43cfc15125c430",
  "destinationPath": "Packages/swift-posix",
  "equality": { "fileList": "verified", "blobs": "verified", "sourceFilesExcludeDestinationMetadata": true },
  "programme": "https://github.com/swift-institute/.github/issues/527",
  "task": "https://github.com/swift-institute/Research/issues/18"
}
