{
  "$schema": "../../Schemas/research-migration-provenance-v1.json",
  "destinationImportCommit": "3f5a1cc2bf6d5723f46f583bb0762864ee534de0",
  "sourceRepository": "swift-foundations/swift-defunctionalize",
  "sourceCommit": "ece5ceda0d90e89368b7582919ab7d87738e8230",
  "sourcePath": "Research",
  "sourceTree": "75f33c096e8053a12a14438d7ed507f26019af8a",
  "destinationPath": "Packages/swift-defunctionalize",
  "equality": {
    "fileList": "verified",
    "blobs": "verified",
    "sourceFilesExcludeDestinationMetadata": true
  },
  "programme": "https://github.com/swift-institute/.github/issues/527",
  "task": "https://github.com/swift-institute/Research/issues/11"
}
