{
  "$schema": "../../Schemas/research-migration-provenance-v1.json",
  "destinationImportCommit": "9cba71e066f8f015c9bc3ff7eef1d95edab42f95",
  "sourceRepository": "swift-primitives/swift-x86-primitives",
  "sourceCommit": "81de8f2390af5ade3efe76f8a19642d77941e97f",
  "sourcePath": "Research",
  "sourceTree": "ae9fe60ee0808851783f1b854f6bbe3e74ef889f",
  "destinationPath": "Packages/swift-x86-primitives",
  "equality": {
    "fileList": "verified",
    "blobs": "verified",
    "sourceFilesExcludeDestinationMetadata": true
  },
  "programme": "https://github.com/swift-institute/.github/issues/527",
  "task": "https://github.com/swift-institute/.github/issues/527"
}
