{
  "$schema": "../../Schemas/research-migration-provenance-v1.json",
  "destinationImportCommit": "ac1d509f3a88a14267f2cb49ea331a0aacdd2298",
  "sourceRepository": "swift-primitives/swift-buffer-primitives",
  "sourceCommit": "fe387e2a92dbbe48a556460688e5101ab0e81432",
  "sourcePath": "Research",
  "sourceTree": "822583c4069622a12ba115d0032bf9a1243418be",
  "destinationPath": "Packages/swift-buffer-primitives",
  "equality": {
    "fileList": "verified",
    "blobs": "verified",
    "sourceFilesExcludeDestinationMetadata": true
  },
  "programme": "https://github.com/swift-institute/.github/issues/527",
  "task": "https://github.com/swift-institute/Research/issues/25"
}
