{
  "$schema": "../../Schemas/research-migration-provenance-v1.json",
  "destinationImportCommit": "ac1d509f3a88a14267f2cb49ea331a0aacdd2298",
  "sourceRepository": "swift-primitives/swift-cardinal-primitives",
  "sourceCommit": "b3155324a437dfa2753933c7919e5f9ce3eb4084",
  "sourcePath": "Research",
  "sourceTree": "d68b684512f06869612221ac1d404f8cd4007892",
  "destinationPath": "Packages/swift-cardinal-primitives",
  "equality": {
    "fileList": "verified",
    "blobs": "verified",
    "sourceFilesExcludeDestinationMetadata": true
  },
  "programme": "https://github.com/swift-institute/.github/issues/527",
  "task": "https://github.com/swift-institute/Research/issues/25"
}
