{
  "$schema": "../../Schemas/research-migration-provenance-v1.json",
  "destinationImportCommit": "41a8e1920c50e46da14e10273fe9f71d496e5027",
  "sourceRepository": "swift-foundations/swift-pdf",
  "sourceCommit": "caa97a77c605d82af6d6e44009fe80bf2a8823be",
  "sourcePath": "Research",
  "sourceTree": "147ebd343a3c3d634ce168f7834320e516c190f0",
  "destinationPath": "Packages/swift-pdf",
  "equality": { "fileList": "verified", "blobs": "verified", "sourceFilesExcludeDestinationMetadata": true },
  "programme": "https://github.com/swift-institute/.github/issues/527",
  "task": "https://github.com/swift-institute/Research/issues/18"
}
