{
  "$schema": "../../Schemas/research-migration-provenance-v1.json",
  "destinationImportCommit": "3a9e9f5859a8816ea2917983fe690770c080f899",
  "sourceRepository": "swift-foundations/swift-linter-rules",
  "sourceCommit": "e5c9c83c1a9ed91ea3456977aa36817e555d2fe6",
  "sourcePath": "Research",
  "sourceTree": "b2c37c8a966ba96a14641d533d04051ae6361669",
  "destinationPath": "Packages/swift-linter-rules",
  "equality": {
    "fileList": "verified",
    "blobs": "verified",
    "sourceFilesExcludeDestinationMetadata": true
  },
  "programme": "https://github.com/swift-institute/.github/issues/527",
  "task": "https://github.com/swift-institute/Research/issues/32"
}
